IMG_421,computer vision application built combination basic computer vision algorithm filter descriptor matcher functionality computer vision toolbox well understood solid implementation exist one leading often used implementation source computer vision library opencv implement computer vision algorithm however algorithm multiple parameter tuned specific vision application therefore development vision application humanintheloop iteration avoided problem opencv lack support phase development usually lead situation developer creates static adhoc debug solution output intermediate result printfdebugging manner remedy situation developed reusable generalpurpose interactive tool visual debugging development opencvbased computer vision application ,4
IMG_422,research presented represents several novel conceptual contribution computer vision literature position goal define scope computer vision analysis discus categorisation computer vision problem first provide novel decomposition computer vision base component term axiom vision used define researcherlevel developerlevel access vision algorithm way require expert knowledge computer vision discus line thought computer vision basing analysis description problem instead term algorithm abstraction developed provide layer algorithmic detail extended idea formal description language may automatically interpreted thus allowing familiar computer vision technique utilise sophisticated method ,4
IMG_423,show speedup attained computer graphic hardware implementation computer vision algorithm efficiently mapping mathematical operation computer vision onto modem computer graphic architecture example computer vision algorithm implement realtime projective camera motion tracking routine modern geforce fx class gpus graphic processing unit algorithm implemented opengl nvidia cg fragment shaders tradeoff computer vision requirement gpu resource discussed algorithm implementation examined closely hardware bottleneck addressed examine performance gpu architecture computer vision shown significant speedup achieved leaving cpu free signal processing task application include wearable computer mediated reality system computer vision computer graphic require realtime processing lowlatency high throughput provided modem gpus ,4
IMG_424,november internet everything column discussed need rethink camera era alwayson operation every corner well also rethink way camera see • today computer vision track car face production process accurately people there lot data sift computervision model better people • limit computer still need time human recognize person action cant follow person object multiple video camera fooled easily cant assign meaning see limit engineer must overcome make camera useful manufacturing smart city • today camera typically perform inferenceusing algorithm match incoming image predefined modelat roughly frame per second speed depends complexity computervision algorithm • inference basically tradeoff among variable cost speed memory accuracy camera quickly infer something might sacrifice accuracy might need memory resulting higher device cost • thirty frame per second fine finding face concert crowd fact however come complicated computervision task determining error manufacturing process computer need speed capability risk slowing production line say sophie lebrecht director operation xnorai company building software improve computer vision xnorais goal track image frame per second ,4
IMG_425,information age requires u ever represent access information last several decade developed modern science technology information retrieval relentlessly pursuing vision memex vannevar bush proposed seminal article may think faceted search play key role program faceted search address weakness conventional search approach emerged foundation interactive information retrieval study demonstrate faceted search provides effective informationseeking support user bestfirst search indeed faceted search become increasingly prevalent online information access system particularly ecommerce site search lecture explore history theory practice faceted search although hope exhaustive aim provide sufficient depth breadth offer useful resource researcher practitioner faceted search area interest computer scientist information scientist interface designer usability researcher assume reader specialist field rather offer selfcontained treatment topic extensive bibliography would like pursue particular aspect depth table content key concept introduction facet ? information retrieval faceted information retrieval ii research practice academic research commercial application iii practical concern backend concern frontend concern conclusion glossary ,4
IMG_426,lecture present research general framework perceptual organization conducted mainly institute robotics intelligent system university southern california written historical recount since sequence presentation chronological order aim presenting approach wide range problem computer vision machine learning datadriven local requires minimal number assumption tensor voting framework combine property provides unified perceptual organization methodology applicable situation may seem heterogeneous initially show several problem posed organization input salient perceptual structure inferred via tensor voting presented extends original tensor voting framework addition boundary inference capability novel reformulation framework applicable highdimensional space development algorithm computer vision machine learning problem show complete analysis problem briefly outline approach application provide pointer relevant source ,4
IMG_427,common feature many approach modeling sensory statistic emphasis capturing average early representation brain highly abstracted class category machine learning classification task centraltendency model based gaussian distribution seemingly natural obvious choice modeling sensory data however insight neuroscience psychology computer vision suggest alternate strategy preferentially focusing representational resource extreme distribution sensory input notion treating extremum near decision boundary feature necessarily comprehensive statistical theory recognition based extremum emerging computer vision literature book begin introducing statistical extreme value theory evt visual recognition contrast centraltendency modeling hypothesized distribution near decision boundary form powerful model recognition task focusing coding resource data arguably diagnostic feature evt several important property strong statistical grounding better modeling accuracy near decision boundary gaussian modeling ability model asymmetric decision boundary accurate prediction probability event beyond experience second part book us theory describe class machine learning algorithm decision making measurable advance beyond stateoftheart includes method postrecognition score analysis information fusion multiattribute space calibration supervised machine learning algorithm ,4
IMG_428,term structure motion sfm coined computer vision community define problem estimating threedimensional structure scene motion twodimensional image sequence monograph considers estimation problem sensor suit also composed inertial sensor accelerometer gyroscope problem referred visualinertial structure motion visfm visfm problem generated particular interest investigated computer science neuroscience sensor require external infrastructure key advantage robot operating unknown environment gps signal shadowed reason vision inertial sensing received great attention mobile robotics community recent year many approach introduced observability property deterministic algorithm visualinertial structure motion provides reader state art visfm also add series result particular result significantly improve current state art providing property related three fundamental issue observability property resolvability closedform data association result important technological point view additionally provide insight comprehension process vestibular visual integration investigated framework neuroscience ,4
IMG_429,realistic virtual world serve laboratory carrying camera network research unorthodox virtual vision paradigm advocate developing visually behaviorally realistic environment serve need computer vision highlevel coordination control camera network testament suitability virtual vision paradigm camera network research prerequisite carrying virtual vision research virtual vision simulator capable generating synthetic imagery simulated reallife scene distributed customizable virtual vision simulator capable simulating pedestrian traffic variety environment virtual camera deployed synthetic environment generate synthetic imagery boasting realistic lighting effect shadow etc stateoftheart computer graphic technique synthetic imagery fed realworld vision pipeline performs visual analysis eg blob detection tracking facial detection etc return result analysis simulated camera subsequent higher level processing important bear mind vision pipeline designed handle real world imagery without modification consequently closely mimic performance vision pipeline one might deploy physical camera virtual vision simulator realized collection module communicate network consequently deploy simulator network computer allowing u simulate much larger network much complex scene otherwise possible ,4
IMG_430,translating euclid report effort transform geometry student stylusandclaytablet corpus historical theorem stimulating computersupported collaborativelearning inquiry experience origin geometry turning point prehistory informatics literacy rational thought yet triumph human intellect became ossified historic layer systematization beginning euclid organization element geometry often taught memorization procedure theorem proof geometry schooling rarely conveys underlying intellectual excitement recent development dynamicgeometry software offer opportunity translate geometry contemporary vernacular however involves transformation multiple dimension conceptual practical context learning translating euclid step multiple challenge involved redesigning geometry education take advantage computer support networked computer portend interactive approach exploring dynamic geometry well broadened prospect collaboration proposed conception geometry emphasizes central role construction dependency design activity integrating human creation mathematical discovery form humancentered approach mathematics book chronicle iterative effort adapt technology theory pedagogy practice support vision collaborative dynamic geometry evolve approach ongoing cycle trial student refinement resource thereby provides case designbased research effort computersupported collaborative learning humancentered informatics perspective ,4
IMG_431,dark secret computer vision image processing research community heavy reliance magic number algorithm magic number often manifest algorithmic parameter must tuned satisfactory result obtained reliance parameter tuning stem part longstanding dogma computer vision algorithm fully automated interestingly requiring tune parameter intuitive meaning hand far automatic fact major stumbling block building real world computer vision application talk advocate many computer vision image processing application magic number avoided instead exploit user help via meaningful interaction approach solving problem termed interactive computer vision proven effective many task segmentation matting image repair specifically ill discus several example research transformed problem either difficult automate heavily reliant parameter tuning application rely simple easy understand interaction supplied ,4
IMG_432,system based bagofwords model image feature collected maximum sparse interest point operator used successfully computer visual object action recognition task sparse interestpoint based approach recognition inconsistent visual processing biological system operate ` saccade fixate regime methodology emphasis human computer vision community remains sharply distinct make three contribution aiming bridge gap first complement existing stateofthe art large scale dynamic computer vision annotated datasets like hollywood ucf sport human eye movement collected ecological constraint visual action scene context recognition task knowledge first large human eye tracking datasets collected made publicly available video visionimarroeyetracking frame viewed subject unique term large scale computer vision relevance b dynamic video stimulus c control well freeviewing second introduce novel dynamic consistency alignment measure underline remarkable stability pattern visual search among subject third leverage significant amount collected data order pursue study build automatic endtoend trainable computer vision system based human eye movement study shed light difference computer vision spatiotemporal interest point image sampling strategy human fixation well impact visual recognition performance also demonstrate human fixation accurately predicted used endtoend automatic system leveraging advanced computer vision practice lead state art result ,4
IMG_433,proliferation closed circuit television cctv camera security surveillance monitoring image processing computer vision technique realised desktop pc processing commercial video motion detection vmd intelligent scene monitoring ism system becoming increasingly sophisticated image processing traditionally concerned preprocessing operation fourier filtering edge detection morphological operation computer vision extends image processing paradigm include understanding scene content tracking object classification example computer vision application include automatic number plate recognition anpr people vehicle tracking crowd analysis model based vision often image processing computer vision technique developed highly specific application mind goal global understanding computer vision system remains outside bound technology review recent development computer vision image processing challenging outdoor perimeter security application also describes effort development team integrate advanced idea coherent prototype development system ,4
IMG_434,age bear witness proliferation closed circuit television cctv camera security surveillance monitoring image processing computer vision technique provided top end bespoke solution realised desktop pc processing commercial video motion detection vmd intelligent scene monitoring ism system becoming increasingly sophisticated aided small way technology transfer previously exclusively military research sector image processing traditionally concerned preprocessing operation fourier filtering edge detection morphological operation computer vision extends image processing paradigm include understanding scene content tracking object classification example computer vision application include automatic number plate recognition anpr people vehicle tracking crowd analysis model based vision often image processing computer vision technique developed highly specific application mind goal global understanding computer vision system remains least outside bound technology recent development computer vision image processing challenging outdoor perimeter security application also describes effort development team integrate advanced idea coherent prototype development system ,4
IMG_435,rise popularity product interface computer vision matched rise usability framework computer vision method endusers hobbyist general developer researcher outside field position present workinprogress set design guideline geared towards developercentred interface order help provide computer vision intuitive accessible manner guideline developed examination previous computer vision humancomputer interaction analysis vision problem inspiration successful abstraction field intended positive reflection current state computer vision interface key guideline state developer interface computer vision must hide detail regarding specific algorithm discus implication framework support guideline ,4
IMG_436,computer vision multidisciplinary domain extract analysis digital image automated manner application computer vision widespread range agriculture robotics computer vision adopts concept machine learning build model solves classification problem however technique becomes inefficient directly applied digital image ignores structure compositional nature image deep convolutional neural network cnn act best solution traditional computer vision approach learns extract feature raw image classification process deep learning based solution computer vision problem first define cnn based approach learn extract feature real time video next extended linear support vector machine svm classifier used object classification process thus proposed method make combinational approach deep learning machine learning solve computer vision problem since deep cnn massively parallel algorithm application cnn technique gpu form effective solution computer vision problem experimental result evaluated term performance accuracy simplicity measure ,4
IMG_437,robot rely computer vision system obtain environmental information result accuracy computer vision system essential control robot many computer vision system make marker welldesigned pattern calculate system parameter undesirably noise exists universally decrease calibration accuracy consequently decrease accuracy computer vision system propose pattern modeling method remove noise decreasing degree freedom total calibration marker one theorem proposed proved proposed method readily adopted different computer vision system eg structured light based computer vision system stereo vision based system ,4
IMG_438,stereo vision one important branch computer vision research among technique stereo vision people paid attention binocular stereo vision based processing two image directly simulates manner human eye observing one scene two different viewpoint binocular stereo vision technology analyzed based opencv important algorithm stereo vision achieved depth information object recovered program making full function opencv method achieves better efficiency accuracy computation well good portability adopted many type computer vision system ,4
IMG_439,advancement deep learning ignited explosion research efficient hardware embedded computer vision hardware vision acceleration however address cost capturing processing image data feed algorithm examine role image signal processing isp pipeline computer vision identify opportunity reduce computation save energy key insight imaging pipeline configurable switch traditional photography mode lowpower vision mode produce lowerquality image data suitable computer vision eight computer vision algorithm reversible pipeline simulation tool imaging system impact vision performance cnnbased classical vision algorithm observe two isp stage demosaicing gamma compression critical performance propose image sensor design compensate stage sensor design feature adjustable resolution tunable analogtodigital converter adcs proposed imaging system vision mode disables isp entirely configures sensor produce subsampled lowerprecision image data vision mode save ~ % average energy baseline photography mode small impact vision accuracy ,4
IMG_440,computational modeling primate visual system yield insight potential relevance challenge computer vision facing object recognition categorization motion detection activity recognition visionbased navigation manipulation review functional principle structure generally thought underlie primate visual cortex attempt extract biological principle could advance computer vision research organized computer vision audience functional principle processing hierarchy primate visual system considering recent discovery neurophysiology hierarchical processing primate visual system characterized sequence different level processing order constitute deep hierarchy contrast flat vision architecture predominantly used today mainstream computer vision hope functional description deep hierarchy realized primate visual system provides valuable insight design computer vision algorithm fostering increasingly productive interaction biological computer vision research ,4
IMG_441,order artificial intelligencebased computer vision imaging computer technology used efficiently accurately obtain relevant information environmental image video thing phenomenon objective world analyzed judged decided based biological vision physical model basic method approach computer vision explored content evolutionary calculation pattern recognition biological vision surface defect detection slab studied computer vision system high adaptability high accuracy rapid response developed result showed evolutionary calculation method erse form versatile therefore applied many aspect computer vision performance good ,4
IMG_442,computer vision research focused mainly calibrated vision system ie painstaking procedure followed order estimate value system internal parameter unfortunately calibration process slow difficult procedure often inadequate accuracy requiring system taken offline large amount time thus leading increased cost moreover guarantee estimated parameter change instance due mechanical environmental reason camera us zoom mechanism uncalibrated computer vision dispenses whole calibration procedure extracting information need image hence allows greater versatility since assumption camera setup made greater robustness since one possible source error ie calibration procedure eliminated particular field underwater application computer vision thermal mechanical strain camera norm usually unknown highly unstructured environment badly illuminated scene noisy image provides environment uncalibrated computer vision technique could prove beneficial demonstrates early result application uncalibrated computer vision technique underwater environment robustness versatility technique demonstrated synthetic data real underwater sequence ,4
IMG_443,recently computer vision neural network based ai technology seen explosive demand embedded system robot drone autonomous vehicle etc due cost power constraint remains quite challenging achieve satisfactory performance maintaining power efficiency scalability embedded vision ai presentation first analyzes technical challenge embedding vision ai perspective algorithm complexity computation memory bw demand constrains power consumption profile analysis show modern neural network vision ai contain complex topology ersified computation step neural network often part large embedded vision processing pipeline intermixed conventional vision algorithm result vision ai implementation demand several top computation performance ten gb memory bw subsequently architecture tensilica vision ai dsp processor technology presented three distinctive advantage optimized instruction set vision p vision c dsp explained example achieving instruction level computation efficiency performance coupled unique processor architecture feature achieving soc level data processing efficiency scalability lead highperformance vision ai subsystem fully automated ai optimization framework software library tool provide practical performance tuning methodology rapid turnaround time embedded vision ai system design conclusion presentation offer consideration future research development bring embedded vision ai next performance level ,4
IMG_444,summary form given effort develop computer system able detect human recognize activity form important area research computer vision today recognition human activity lead number application including personal assistant virtual reality smart monitoring surveillance system well motion analysis sport medicine choreography motion important cue human visual system understanding human action subject intense number field including philosophy psychology neurobiology course computer vision robotics computer graphic computer vision research motion played important role past thirty year prof aggarwals interest motion started motion rigid planar object gradually progressed human motion current research includes interaction gross blob level detailed head torso arm leg level two level different problem term observation analysis blob level analysis modified hough transform called temporal spatiovelocity transform isolate pixel similar velocity profile detailedlevel analysis employ multitarget multiassignment strategy track blob consecutive frame event hierarchy consisting pose gesture action interaction used describe humanhuman interaction methodology developed describe interaction semantic level professor aggarwals presentation focus contribution field leading motion computer vision address issue interaction blob level detailed level addition address direction future research motion human activity recognition ,4
IMG_445,degreeoffreedom dof chess playing robotic manipulator computer vision based chess recognition system presented robotic system capable playing chess game autonomously human another robotic system logical system consists antiglare camera mounted chessboard act eye robot personal computer runtime implementation computer vision algorithm opensource chess engine used chess brain robotic manipulator play chess algorithmic ally behalf robot course robot development side simple image segmentation based computer vision algorithm developed find legitimate chess move human hand motion detection software system developed enables robot pick drop chess piece prescribed chess box lastly communication channel exploited interfacing computer vision algorithm chess engine whole robotic system formulated recycled machine part source tool convincing performance computer vision algorithm robotic manipulator testifies st position ieee final project competition lahore ,4
