IMG_591,stereo vision important computer vision technique estimate depth information two image similar human vision work however computational intensity stereo vision deters implementation realtime system recently massively parallel processor called graphic processing unit gpus gaining traction acceleration platform offload computeintensive task present development gpuaccelerated stereo vision system called depthstream depthstream algorithm us combined absolute difference census cost crossbased cost aggregation bitwise fast region voting achieve error rate × lower blockmatching based algorithm mainstream library leveraging parallel processing power gpus offer enables depthstream algorithm achieve processing time × faster semiglobal matching based implementation library also includes measurement accuracy estimated distance developed stereo vision system result show estimated depth depthstream stereo vision system % true value distance le statistical analysis also indicate significant difference stereo vision system estimated distance actual value ,4
IMG_592,advance image processing computer vision technique developed longer limited image acquired single camera namely plane vision stereo vision system two camera become research interest many area ability yield depth information similar human vision objective develop system automatically track localize feature motion left right video sequence system design included feature definition feature tracking feature localization depth computation addition evaluated system several research parameter including various depth video tracking plane vision stereo vision kernel function integerpixel v subpixel accuracy result demonstrated system could track localize given feature motion leading yield reasonable result depth information addition video tracking stereo vision subpixel accuracy clearly outperformed video tracking plane vision integerpixel accuracy summary system yielded potential solution tracking localizing feature could incorporated large variety video application ,4
IMG_593,multilayer mimd computer variable solution computer vision due flexibility computational power however performance parallel program executed system dependent efficiency interprocessor communication based hybrid multilayer mimd computer vision computer messagepassing mechanism software system developed handle complex communication operation communication model routing algorithm switching technique established evaluated extensive experiment conducted determine hardware parameter communication link computer furthermore communication algorithm frequently required parallel vision algorithm developed performance presented ,4
IMG_594,human computer interaction keep moving toward interface natural intuitive comparison traditional keyboard mouse hand gesture important modality human computer interaction hci compared many existing interface hand gesture advantage easy natural intuitive successful application hand gesture recognition include computer game control humanrobot interaction sign language recognition name visionbased recognition system give computer capability understanding responding hand gesture aim technique proposal real time vision system application visual interaction environment hand gesture recognition generalpurpose hardware low cost sensor like simple personal computer usb web cam could make office home basis approach fast segmentation process obtain moving hand whole image able deal large number hand shape different background lighting condition recognition process identifies hand posture temporal sequence segmented hand visual memory stored database allows system handle variation gesture speed recognition process storage different variable related gesture successfully implemented visionbased system interpret user gesture real time speech application programming interface sapi control window o action like single click double click forward backward medium player notepad calculator ,4
IMG_595,ieee smart grid vision computing beyond provides result ieee computer society smart grid vision project cssgvp chartered develop smart grid vision looking forward far year future vision stimulate investment computing technology research development standard education enable realization smart grid goal document ieee smart grid vision computing beyond roadmap provides timephased evolution smart grid characteristic computing technology described computing vision across nearterm year midterm year longterm + year period corporate institutional access request custom quote organization wwwieeeorgsmartgridresearch ,4
IMG_596,article present project design robust robotic arm perform multifunctional task controller manipulator based arduino mega microcontroller aim project focus ax manipulator lift carry unload object desired location requires precise drive motion control incorporate electric motor drive system experiment done implement camera based vision system integrated computer vision algorithm recognize object deformation spatial coordination control deviation original training visualization system able detect object well distance endeffecter transmit signal drive system vision system requires separate computing hardware capable processing complex vision algorithm utilize raspberry pi microcontroller processing vision data separately making vision system capable recognizing specified object per program command ,4
IMG_597,compound vision system common housefly musca domestica better motion detection tracking capability compared traditional camera system based human vision therefore compound vision sensor mimic vision common housefly far advantageous application requiring object detection obstacle avoidance recent proofofconcept shown compound vision sensor posse motion hyperacuity characteristic fly visual system instantaneous edge detection capability without need computer processing system however current musca domestica inspired vision system one cartridge detect edge center field view multicartridge sensor design presented allow robust edge detection orientation capability compound vision sensor design ,4
IMG_598,laparoscopic surgery surgeon often encounter paradoxical vision according position camera position paradoxical vision evokes confusion surely deteriorates surgical performance previous research indicated inverted mirror image useful compensate problem though upsidedown inversion make depth sensation perplex solve dilemma proposed modified method display inverted mirror image plus perspective projection add simulated depth cue preparing image adjustment software trainer box touch panel device measure motion forceps tested validity participant including experienced surgeon participant requested push button following computer assignment ten time three condition stand parallel camera stand opposite side camera stand opposite side camera watching inverted mirror image perspective projection mean duration time completion + second subject stand parallel camera + second + second subject stand opposite side camera without transformed image respectively paradoxical vision significantly deteriorated performance p & amplt however compensated inverted mirror vision perspective projection significantly p & amplt rope passing bead drop trial tested experienced surgeon inverted perspective vision significantly compensated deteriorated performance paradoxical vision inverted mirror image perspective projection would useful tool correction paradoxical vision laparoscopic surgery research would warranted make system practical ,4
IMG_599,increasing development modern information logistics industry intelligent logistic technology essentially equipped field advanced computer vision technology definitely play key role way achieve discussed special setting binocular vision system targeting reconstruct geometric structure object mail package intelligent logistic field special binocular vision system two basic component one camera two flat mirror order improve virtual binocular vision system accuracy much possible angle two virtual camera mirror arranged orthogonally loss common surface image however setting mattered eventually come problem reconstructing side corner object destination estimate shape volume object therefore configuration virtual binocular vision system theoretical analysis illustrated detail experiment well result guaranteed excellent performance kind binocular vision method ,4
IMG_600,resolution size tft lcd becoming higher larger respectively inspection system required high resolution detect dirt impurity crack etc also order reduce cost inspect tft lcd inspection time must reduced one important subsystem tft lcd inspection system vision system existing vision system insufficient perform inspection task large tft lcd short time highspeed highresolution vision system inspection large tft lcd proposed developed order desired resolution large area proposed vision system obtain image information line scan camera rather expensive highresolution area camera order reduce time vision system consists four highperformance digital signal processor dsp parallel architecture pipeline algorithm developed reduce time process image data multiple line scan camera based architecture algorithm appropriate assigned dsp result reducing imageprocessing time pci bus developed vision system connected personal computer pc provide convenient interface experiment show performance developed vision system performed ,4
IMG_601,deep learning emerged method choice many computer vision application training deep network involves utilization loss function cross entropy propose novel auxiliary loss function silhouette loss training deep network objective obtaining feature representation tightly clustered highly separable motivated need wellclustered feature generalize effectively classification erse test sample also introduce adaptive scaling scheme regularization parameter auxiliary loss improves robustness eliminates selection another hyperparameter training small network auxiliary loss achieve classification performance comparable larger network yet network efficient utilizes much fewer parameter ,4
IMG_602,rapid growth automation manufacturing industry result demand better computer vision hence computer vision play important role product inspection assembly design reverse engineering discus briefly importance certain graph theory technique developing method automatic sensor placement including optimal sensor placement improved computer vision ,4
IMG_603,microscopic size wear debris transported oillubricated system provides important information condition machinery particular state wear expert extract information monitor operation machine ensure safety efficiency economy operation describes analysis microscopic wear particle computer vision image processing technique aim develop automated system classify wear particle thereby predict wear failure mode machine interactive image analysis system wpias devised used process store quantitative information particle profile size quantity shape edge detail analysis analysis stored data also described permit systematic morphological analysis wear particle ,4
IMG_604,present multimodal computer vision framework human assistive robotics giving accessibility person disability capable interacting system staring specifically possible select desired object well indicate intention grasp staring gaze information provided ©tobii glass combination deep learning algorithm give class id desirable object later object pose estimated rgbd camera developed technique technique mix template based algorithm deep learning algorithm giving precise realtime method pose estimation pose obtained transformed grasping position coordinate system assistive robot performs grasping operation ,4
IMG_605,implementation reliable object avoidance crucial survival autonomous vehicle intended navigate densely populated environment uninhabited aerial vehicle uavs constitute type self guided platform must rely different type sensor order navigate autonomously exploratory nature uavs made vision system desirable option solve object avoidance problem utilizing image data rich source environmental information base object detection collision avoidance motion estimation computer vision technique developed throughout year order estimate motion two dimensional image algorithm computationally expensive thus fail meet real time constraint imposed uav flight however recent development optic flow technique color imagery giving vision system potential solve certain navigation challenge uav platform fixed wing uav platform described constraining issue presented discussed different implementation color optic flow algorithm tested actual flight video footage finally viability optic flow desirable technique real time motion estimation evaluated ,4
IMG_606,shape representation modeling based implicit function received considerable attention computer vision literature propose extended hyperquadrics generalization hyperquadrics developed hanson modeling global geometric shape extended hyperquadrics strengthen representation power hyperquadrics especially object concavity discus distance measure extended hyperquadric surface given data set minimization obtain optimum model parameter several experimental result fitting extended hyperquadrics real synthetic data demonstrate extended hyperquadrics model complex shape hyperquadrics maintaining many desirable property hyperquadrics ,4
IMG_607,following topic dealt image segmentation solid modelling computational geometry image sampling image resolution mesh generation image reconstruction image registration computer graphic rendering image scanner computer vision optical projector optical sensor camera ,4
IMG_608,investigate utility static anthropometric distance biometric human identification landmark data caesar database used form simple biometric consisting distance fixed rigidly connected body location biometric overt invariant view body posture quantify asymmetry human body characterize interpersonal intrapersonal distance distribution former computed directly latter adding zeromean gaussian noise landmark point simulation framework applicable arbitrary shape based biometrics gross body proportion information model computer vision recognition system ,4
IMG_609,method presented estimate head pose effectively hybrid sensing depth gray information depth information used generate clean head segmentation even cluttered scene based segmentation result sparse optical flow head region extracted used head motion estimation video rate method shown effective experiment video sequence method provides alternative way head pose estimation image sequence current computer vision literature moreover depth information incorporated estimation step regularization noisy motion estimation problem ,4
IMG_610,augmented reality system relies purely passive technique solve realtime registration problem run portable pc require engineering environment example adding marker achieve result integrated robust computer vision technique powerful vr framework resulting ar system allows u produce complex rendering animation virtual human character blend real world system track camera position mean natural feature tracker given rough cad model deal complex object tracking method handle large camera displacement aspect change show system work cluttered environment real industrial facility therefore used enhance manufacturing industrial process ,4
IMG_611,range image refinement technique generating accurate computer model real object range image obtained stereovision system typically experience geometric distortion reconstructed surface due inherent stereo matching problem occlusion mismatchings introduce range image refinement technique correct erroneous range employing epipolar geometry multiview modelling system visual hull object registering multiple range image common coordinate system first determine point range image erroneous measuring registration point correspondence range image correspondence determined contour inverseprojections epipolar line silhouette image range point refined onto object surface erroneous employ two technique search correspondence fast case correspondence erroneous point refine point onto visual hull object show refined range image yield better geometric structure reconstructed model ,4
IMG_612,adaptive fusion information urban scene important goal achieve computer vision graphic visualization acquire image pair scene closer distance extract model successively higher resolution hierarchical approach register texturemapped model coarse texture mapped model urban scene first standard reconstruction algorithm construct model establishing correspondence feature point two image resolution next subset feature point used register higher resolution image lower resolution image scalesensitive algorithm finally register consistently merge model different resolution result hierarchical algorithm adaptive enhancement mural inside ucsc campus registering data differ scale ratio result indicate proposed hierarchical registration technique effectively utilizes intermediate model enable smooth registration high resolution model coarser model ,4
IMG_613,aperture problem one omnipresent issue computer vision local character constrains point matching high textured area point gradientoriented region straight line reliably matched propose method overcome problem devising global matching strategy factorization framework solve nframe correspondence problem context assuming rigidity scene end geometric constraint used selects matching solution resulting rank observation matrix rank observation matrix function matching solution associated image simultaneous solution frame found optimization procedure used text order find solution ,4
IMG_614,existing technique viewbased object recognition computer vision rely training system particular object introduced environment training often consists taking image predetermined point around viewing sphere attempt account angle viewing object however many circumstance environment well known expect see small subset possible appearance test idea condition possible train object recognition system onthefly image object appears environment supervision furthermore view object much likely others number training image required greatly reduced ,4
IMG_615,give formal definition geometric fitting way suit computer vision application point performance geometric fitting evaluated limit small noise rather limit large number data recommended statistical literature taking kcr lower bound optimality requirement focusing linearized constraint case compare accuracy kanatanis renormalization maximum likelihood ml approach including fns chojnacki et al heiv leedan meer analysis reveals existence method superior ,4
IMG_616,present technique projecting object mesh model onto surface another target object mesh model adapts shape target surface called selforganizing deformable modelsdm sdm algorithm work combining competitive learning energy minimization framework sdm make possible map mesh model onto various kind target surface characteristic seen method surface parameterization enables u apply sdm different field computer vision computer graphic also sdm reconstruct shape target object similar general deformable model ,4
IMG_617,multilinear tensor algebraic framework image synthesis analysis recognition natural image result multifactor interaction imaging process illumination scene geometry numerical multilinear algebra provides principled approach disentangling explicitly representing essential factor mode image ensemble multilinear image modeling technique employ tensor extension conventional matrix singular value decomposition svd known nmode svd lead u multilinear generalization principal component analysis pca novel multilinear generalization independent component analysis ica example application tackle currently significant problem computer graphic computer vision pattern recognition particular address imagebased rendering specifically multilinear synthesis image textured surface varying viewpoint illumination well multilinear analysis recognition facial image variable face shape view illumination condition multilinear tensor algebraic method outperform conventional linear matrix algebraic counterpart ,4
IMG_618,object pose location orientation estimation common many computer vision application although many method exist algorithm need manual initialization lack robustness illumination variation appearance change partial occlusion propose fast method automatic pose estimation without manual initialization based shape matching model range image scene developed error function compare input range image precomputed range map model tremendous data parallel processing performance modern graphic hardware evaluate minimize error function many range image parallel algorithm simple accurately estimate pose partially occluded object cluttered scene one second ,4
IMG_619,order automatically extract arbitrary region image data volume data developed physicsbased approach deformable grid model called active grid active grid extension deformable surface model balloon active net unlike deformable surface model proposed method enables stable extraction region boundary interior information moreover since generated geometry data input directly fem finite element method active grid many potential application including virtual simulation surgery shape modeling computer vision ,4
IMG_620,proposes omnidirectionaltopanoramic image transform high accuracy pdebased resampling model application computervision technique omnidirectional image transformation omnidirectional image uniformresolution quadricsurface image needed two reason first omnidirectional image uniform resolution second development computervisionbased technique quadric surface mathematically accurate compared development technique omnidirectional image directly therefore aim generate uniformresolution panoramic image cylindrical surface nonuniformresolution omnidirectional image uniformresolution panoramic image allow u reconstruct object scene omnidirectional image robustly panoramic transformation selects uniform resolution pixel omnidirectional image employing geometrical configuration camera estimation resampling process therefore method mathematically accurate comparing traditional panoramic transformation pointtopoint correspondence geometry camera cubic convolution ,4
IMG_621,develop computer visionbased system transfer human motion one subject another system us network eight calibrated synchronized camera first build detailed kinematic model subject based algorithm extracting shape silhouette across time g cheung et al model used capture motion joint angle subject video sequence finally describe imagebased rendering algorithm render captured motion applied articulated model another person rendering algorithm us ensemble spatially temporally distributed image generate photorealistic video transferred motion demonstrate performance system rendering throwing kungfu motion subject perform ,4
IMG_622,processing image sequence progressed simple structure motion paradigm recognition actionsinteractions event understanding human activity video many potential application including automated surveillance video archivalretrieval medical diagnosis sport analysis humancomputer interaction understanding human activity involves various step lowlevel vision processing segmentation tracking pose recovery trajectory estimation well highlevel processing task body modeling representation action lowlevel processing actively studied highlevel processing beginning receive attention partly highlevel processing depends result lowlevel processing however highlevel processing also requires independent additional approach methodology focus following aspect highlevel processing human body modeling level detail needed understand human action approach human action recognition highlevel recognition scheme domain knowledge illustrated example area discussed including recent development understanding human activity ,4
IMG_623,city modeling computer vision challenging typical city contains object nightmare vision algorithm algorithm designed identify exactly part turn suffer weakness limit application instance moving car metallic surface degrade result city reconstruction algorithm primarily based assumption static scene diffuse reflection property hand specialized object recognition algorithm could able detect car also yield many false positive without availability additional scene knowledge design cognitive loop intertwines aforementioned algorithm demonstrated city modeling proving whole much simple sum part cognitive loop mutual transfer higher knowledge algorithm enables combination algorithm overcome weakness single algorithm demonstrate promise approach realworld city modeling video data recorded survey vehicle result show cognitive combination algorithm delivers convincing city model improve upon degree realism possible purely reconstructionbased approach ,4
