IMG_1,integration man protective suit computer integral part vision presented science fiction movie book since long borg strode across star trek screen easy envision computer countless way augment human perception recall reaction provide huge gain personal safety capability however reality today space walker fall well short visionary projection confines space shuttle space station left behind computer support pretty much limited throughput simple one line text display bandwidth human voice relay channel practical issue device size power consumption environmental tolerance display control interface compatibility real design constraint space suit frustrated multiple attempt past year make envisioned possibility real nasa industry effort produce advanced eva computer support system head display wrist mounted display modification current chest mounted display control system fallen short demanding environment nasa space mission far correct balance utility reliability compact size weight eluded developer space remained unconquered frontier wearable undaunted faithful continued quest dramatic advance hardware software system seen past decade path achieving vision seems last clearing key element development emergence display technology make practical rapidly large amount information suited crew person space advance processing capability speech recognition software offer potential flexible eva control interface combination high density storage wireless network technology multiplying amount kind information upon eva astronaut draw together emerging vision exploration mission demand complex interaction unprecedented real time support development lead conclusion must space wearable wearable space ,4
IMG_2,optical processor perform required operation various level hierarchical inference computer vision system scene analysis detection enhancement recognition feature extraction classification multifunctional programmable optical architecture ,4
IMG_3,computing correct illumination virtual scene wellexplored area today commonly used graphic library like opengl directxdirectd contain function task shadow catcher approach us shadow light source cast socalled sensor geometry determine position light source analyzing shape shadow position shape geometry known system artoolkit currently used track position geometry solution independent underlying tracking system system us computer vision methodology detect shadow silhouette surface geometry knowledge geometry shape together information shadow silhouette used compute position light source ,4
IMG_4,developed tao modelsup spl copy technology application organization innovation roadmap perspective inidual company however product one company may production mean next found fully understand innovative business cluster stack chain tao useful presentation capturing whole organizational cluster corporation chain one business representation studying dynamic inidual tao network became clear also dynamic knowledge stream play important role inidual organization knowledge loop cycle time difference cycle time may limit exchange information therefore tao function performed company limiting innovation especially university government funded laboratory government fundedresearch program long cycle time play important role potential mismatching difference dynamic insight stack chain tao dynamic behavior guideline may derived setting effective innovation program university commercial research institute funded research program methodology presented successfully applied anchoring result relation network government funded innovative research program computervision image processing netherlands ,4
IMG_5,effective digital video greatly improved combination two technology computer vision automated video analysis information visualization data visualization unstructured spatiotemporal nature video pose tough challenge extraction semantics fully automated technique cuevideo project combine automated technology together interface designed rapid filtering comprehension video content interface introduces two technique viewing video build upon existing technique provide synergistic view video content also preliminary compare efficacy view providing comprehension video content ,4
IMG_6,lsubsubnorm lowrank matrix factorization lrmf attracting much attention due wide application computer vision pattern recognition construct hierarchical bayesian generative model lsubsubnorm lrmf problem design meanfield variational method automatically infer parameter involved model closedform equation variational bayesian inference proposed method understood solving weighted lrmf problem different weight matrix element based significance lsubsubregularization penalty parameter throughout inference process method weight imposed matrix element adaptively fitted adverse influence noise outlier embedded data largely suppressed parameter appropriately regularized generalization capability problem statistically guaranteed robustness efficiency proposed method substantiated series synthetic real data experiment compared stateoftheart lsubsubnorm lrmf method especially attributed intrinsic generalization capability bayesian methodology method predict better unobserved ground truth data existing method ,4
IMG_7,recent year deep learning network substantially improved performance face recognition although deep learning network successful limited underlying euclidean structure data dealing complex signal medical imaging genetics social network computer vision recently growing interest trying apply learning noneuclidean geometric data graph convolutional network deep learning architecture analyzing noneuclidean geometric data computer vision human face image modeled graph irregular domain major technical challenge optimize structured face graph classification performance critically depends quality graph explore undirected graph convolutional network called ksupsupsgcns ksupsupsparse graph convolutional network idea sparsityconstrained optimization obtain connected sparse subgraphs sparse graph face image composed connected sparse subgraphs experiment demonstrate learned sparse graph better performance mutual knearest neighbor graph l graph ,4
IMG_8,propose ini dimensional scale invariant feature transform inisift method extracting matching salient feature scalar image arbitrary dimensionality compare method performance related feature proposed feature extend concept used scalar image computer vision sift technique extracting matching distinctive scale invariant feature apply feature image arbitrary dimensionality hyperspherical coordinate gradient multidimensional histogram create feature vector analyze performance fully automated multimodal medical image matching technique based feature successfully apply technique determine accurate feature point correspondence pair mri image dynamic + time ct data ,4
IMG_9,human activity analysis video increasingly attracted attention computer vision research massive number video accessible online although many recognition algorithm reported recently activity representation challenging recently manifold regularized sparse coding obtained promising performance action recognition simultaneously learns sparse representation preserve manifold structure propose generalized version laplacian regularized sparse coding human activity recognition called plaplacian regularized sparse coding plsc proposed method exploit plaplacian regularization preserve local geometry plaplacian nonlinear generalization standard graph laplacian tighter isoperimetric inequality result plsc provides superior theoretical evidence standard laplacian regularized sparse coding proper p also provide fast iterative shrinkagethresholding algorithm optimization plsc finally input sparse code learned plsc algorithm support vector machine conduct extensive experiment unstructured social activity attribute dataset human motion database hmdb human activity recognition experimental result demonstrate proposed plsc algorithm outperforms manifold regularized sparse coding algorithm including standard laplacian regularized sparse coding algorithm proper p ,4
IMG_10,learning content video easy traditional machine learning approach computer vision difficulty satisfactorily however past year machine learning community seen rise deep learning method significantly improve accuracy several computer vision application eg convolutional neural network convnets explore suitability convnets movie trailer genre classification problem assigning genre movie particularly challenging genre immaterial feature physically movie frame offtheshelf image detection model directly applied context hence propose novel classification method encapsulates multiple distinct convnets perform genre classification namely connect convnet learns feature capture distinct aspect movie frame compare novel approach current stateoftheart technique movie classification make wellknown image descriptor lowlevel handcrafted feature result show connect significantly outperforms stateoftheart approach moving towards effectively solving genre classification problem ,4
IMG_11,computational visual perception seek reproduce human vision combination visual sensor artificial intelligence computing end computer vision task often reformulated mathematical inference problem objective determine set parameter corresponding lowest potential taskspecific objective function graphical model popular formulation field past two decade problem viewed discrete assignment labeling one modularity scalability portability strength method combined efficient inference algorithm could lead state art result monograph focus inference component problem particular discus systematic manner commonly used optimization principle context graphical model look inference low rank model interaction variable constrained pair well higher order one arbitrary set variable determine hypercliques constraint introduced seek concise selfcontained presentation prior art well presentation current state art method field ,4
IMG_12,theory spl musynthesis introduced provides principle broadly applicable theory optimal synthesis multiloop feedback control law robustly meet performance disturbance attenuation specification despite unknownbutbounded nonlinearities parameter variation commercial matlabbased software package implementing crude approximation theory available computer package address complex spl musynthesis problem via somewhat flawed implementation original dk iteration algorithm involves repetition following three operation suitable augmented closedloop system transfer function optimize diagonal scaling frequency response matrix djw fixed control law k perform ad hoc state space curvefit djw hsup spl infin control compute control law k diagonal scaling d fixed curvefitting step major obstacle realization original vision completely automated spl musynthesis procedure robust control design describes theoretical result enable one bypas difficult awkward curvefitting step result first reliable computational algorithm spl musynthesis controller design technique implemented matlab example involving real spl musynthesis acc benchmark problem included ,4
IMG_13,nonparametric statistical method mean shift algorithm recently attracted much attention computer vision community due efficiency motion tracking clustering analysis although convergence mean shift algorithm already proved still pitfall convergence behavior remain unobserved investigate premature convergence phenomenon mentioned algorithm two necessary condition examine premature convergence analytically derived give example confirm correctness proposed theorem ,4
IMG_14,long ago often said computer vision could compete visual ability oneyearold longer true computer recognize object image well adult computerized car road drive safely average sixteenyearold could rather told see drive computer learned experience following path nature took million year ago fueling advance gusher data data oil learning algorithm refinery extract information raw data information used create knowledge knowledge lead understanding understanding lead wisdom welcome brave world deep learning ,4
IMG_15,recent year researcher paid attention computer vision pattern recognition humancomputer interaction recognizing barcode realtime video embodiment technique present algorithm locate barcode region complex background regionbased image analysis different traditional regionbased image analysis algorithm carried integral image feature including high density unidirectional gradient area rectangle like shape barcode region utilized recognition ,4
IMG_16,weighted median form either solver filter employed wide range computer vision solution beneficial property sparsity representation hard accelerated due spatially varying weight median property propose efficient scheme reduce computation complexity r kernel size contribution jointhistogram representation median tracking data structure enables fast data access effectiveness scheme demonstrated optical flow estimation stereo matching structuretexture separation image filtering name running time largely shortened several minute le second source code provided project website ,4
IMG_17,describes highframerate hfr vision system detect multiple object image × pixel frame per second fps optimized algorithm proposed based conventional histogram oriented gradient hog descriptor support vector machine svm classifier algorithm hardware implementation implementing proposed algorithm fieldprogrammable gate array fpga highspeed vision platform multiobject image detected fps complex background hardware implementation pixel processed parallel mhz camera clock source image detection result transferred personal computer pc realtime recording postprocessing developed hfr multiobject detection system verified performing several evaluation ,4
IMG_18,booming number computer vision speech recognition signal processing application increasingly benefiting deep convolutional neural network dcnn stemming seminal lecun et al others led winning imagenet large scale visual recognition challenge alexnet dcnn significantly outperforming classical approach first time order deploy technology mobile wearable device hardware acceleration play critical role realtime operation limited power consumption embedded memory overcoming limitation fully programmable solution ,4
IMG_19,energyefficient knearestneighbor knn computation key building block computer vision classification machinelearning workload determining distance highdimensional vector large vector database result high compute cost adaptive precision improves energy efficiency eliminating majority vector without costly fullprecision computation asneeded precision refinement guarantee knn accuracy closely matched vector specialpurpose ondie knn accelerator dimension parallel reference vector targeted across mobile socs multicore microprocessor reconfigurable either manhattan euclidean distance fabricated nm trigate cmos partial distance compute circuit b windowbased sort msbtolsbbased selective distance refinement robust ultralow voltage circuit state tracking control selectively resume nextnearest candidate enable nominal energy efficiency njquery vector topsw measured vector cyclesvector mv °c dense layout occupying mm fig achieving scalable performance vector mw measured mv ii cycle latency pj energy find subsequent nearest neighbor iii × higher throughput maintaining fullprecision knn accuracy iv × searchspace reduction nextnearest neighbor v ultralow voltage operation measured mv vector mw vi peak energy efficiency njvector mv nearthreshold °c ,4
IMG_20,deep learning convolutional neural network cnn give stateoftheart accuracy many computer vision task eg object detection recognition segmentation convolution account % processing cnns inferencetesting training fully convolutional network increasingly used achieve stateoftheart accuracy requires cnns larger number layer also million filter weight varying shape ie filter size number filter number channel shown fig instance alexnet us million weight mb storage requires million mac per × image kmacspixel vgg us million weight mb storage requires billion mac per × image kmacspixel large number filter weight channel result substantial data movement consumes significant energy ,4
IMG_21,second fame interactive art installation elevates face randomly selected gallery visitor second art installation inspired andy warhol statement future everybody world famous fifteen minute well popart style work installation consists computer flatpanel monitor digital camera proprietary software detect human face image graphically transform technical background installation particular computer vision technique applied art installation ,4
IMG_22,following topic dealt evolutionary computing genetic algorithm artificial intelligence data mining search algorithm pattern recognition speech understanding vision understanding learning algorithm planning scheduling fuzzy logic agent system computer network wireless network knowledge management image recognition software engineering computational intelligence image analysis image understanding machine learning optimization bioinformatics ,4
IMG_23,following topic discussed computer vision image analysis face human analysis face recognition character recognition document analysis clustering algorithm signal speech image processing signal coding compression document image enhancement visualization restoration system robotics application biometrics biomedical imaging fingerprint range imaging remote sensing application cognitive approach soft computing gesture emotion recognition human computer interaction semantic analysis content retrieval pattern shape analysis stereo motion learning algorithm visual pattern recognition image data representation image registration object detection recognition pattern matching pattern classification gait body pose writer recognition medical image processing superresolution multimodal recognition texture analysis image segmentation illumination feature analysis finger palm iris recognition information retrieval kernel method smart sensor surveillance ,4
IMG_24,propose visual servo control approach develop corresponding software perform micrograsping task twodimension plane specifically degreeoffreedom dof robotic manipulator manipulate microgripper automatically grasp micropart proposed control scheme two type position feedback signal utilized one relative position micropart respect microgripper measured developed computer vision system used visual servo control absolute displacement micropart measured fixed linear encoders used check corresponding motion whole control software developed labview improve operation speed furthermore twostage grasping strategy employed first stage patternmatching performed bonded microgripper controlled directly reach specific position adjacent mating edge designated micropart coordinate second stage patternmatching performed control update interval microgripper displaced towards micropart step order one micron magnitude micropart completely grasped experiment conducted dof experimental manipulator demonstrate efficiency validity proposed control approach grasping strategy ,4
IMG_25,pose estimation important research topic field computer vision artificial intelligence focus stateofart progress human pose estimation method based deep learning according neural network structure method classified single cnn method multistage cnn method multibranch cnn method recurrent neural network rnn method generative adversarial network gan method summarize analyze attribute performance future development direction also prospected ,4
IMG_26,time important factor determine market performance product accelerating process test development one solution probing involved process hence designing system assist engineer component searching probing process critical discus designed system consists national instrument embedded board ni sbrioxt movable laser pointer two stepper motor limiting switch sensor attached origin webcamera image processing location device test personal computer act host link pcb design software eagle national instrument graphical programming environment labview batch file incorporate hardware image processing part done labview vision acquisition software designed system able detect printed circuit board pcb maximum dimension × mm system tested promising result system able locate electronic component pcb requested testing ,4
IMG_27,following topic dealt mobile robot navigation biped robot control wheel mechanism agriculture offroad robotics vision computeraided scheduling actuator design biorobotics mobility manipulation microrobotics human robot interaction sensor localization mapping slam omnidirectional vehicle omnidirectional vision helicopterair vehicle network manufacturing system medical diagnostic robotics dexterous hand control distributed robotic system parallel robot computational intelligence haptic interface localization visionbased navigation multi mobile robot system underwater robotics semiconductor factory automation adaptive control endoluminal surgery grasping analysis microsystems vision based navigation biped locomotion multilegged robot visual sensing automated system design petri net map building humanoid robotics software platform network robotics stereo vision visual tracking robotic surgery quadruped walking robot snakelike robot intelligent transport system rehabilitation robotics mathematical optimization sensorbased robotics path planning multivehicle system space robot assembly system planning telerobotics advanced industrial robot system motion planning neurorobotics teleoperation visual tracking computer aided production planning impedance control virtual reality nonholonomic path planning robot programming visual servoing intelligent environment learning control remote robotics probabilistic roadmap ,4
IMG_28,following topic dealt digital signal processing spectrum estimation modeling higherorder spectral analysis wavelet transforms array signal processing hardware implementation speech audio coding speech synthesis recognition image processing understanding video compression streaming computer vision multimedia humancomputer interaction statistic learning pattern recognition neural network communication signal processing internet wireless communication radar signal processing biomedical cognitive science bioinformatics signal processing security sonar signal processing localization ,4
IMG_29,following topic dealt cybernetics adaptive computing multiagent system computational intelligence computer vision pattern recognition data mining biomolecular computing intelligent data processing image processing particle swarm optimization evolutionary computation fuzzy control genetic algorithm neural network fuzzy system ,4
IMG_30,following topic dealt cybernetics intelligent system adaptive computing agent computational intelligence computer vision pattern recognition data mining management automation robotics biomolecular computing intelligent data processing image processing particle swarm optimization evolutionary computation fuzzy control genetic algorithm neural network multiobjective optimization intelligent transportation system manufacturing system neurofuzzy system humancomputer interaction humanmachine system soft computing knowledge acquisition engineering decision support system ,4
IMG_31,following topic dealt computational intelligence biomedical application environmental science intelligent information extraction optimization hardware implementation image processing computer vision neural network fuzzy logic control engineering ,4
IMG_32,following topic dealt compton scatter correction lung spect high resolution imaging positron emitter pet imaging blurring effect contrast enhanced ct image mammogram segmentation massive lesion classification neural network attenuationmap quantity spect oncology image partial volume effect xray tomography image reconstruction pet attenuation correction threedimensional image registration brain imaging breast cancer zr doped gsoce single crystal digital medical imaging system hpge detector photon counting xray ct system ultrasound computer tomography data acquisition synchroton radiation imaging pet reconstruction optimisation transfer algorithm stereo computer vision system avalanche photodiode array small animal pet detector pinhole spect dosem reconstruction micropet evaluation thin lso crystal sheet positionsensitive avalanche photodiode hybrid convolution algorithm montecarlo based statistical spect reconstruction xray imaging system robust visual tracking system patient motion detection dose calculation oncological study tumour detection dynamic cardiac spect imaging brain mr image segmentation hidden markov random field model perfusion imaging dual energy angiographic system radiotherapy multispectral dermatological imaging optical imaging cardiovascular transit time lead shielding background organ activity ,4
IMG_33,following topic dealt diffusion tensor imaging cardiac vascular imaging atlas nonrigid image registration ultrasound imaging restoration meg eeg imaging computer vision system biology pet spect image reconstruction image segmentation shape analysis image guided diagnosis surgery therapy diffusion tractography cellular molecular image analysis optical infrared imaging multimodality imaging opensource software mri optical microscopy imaging functional dynamic parametric imaging image enhancement functional brain imaging xray ct image retrieval ,4
