IMG_214,system based fuzzy finite state machine ffsm developed evaluating cytological feature derived directly digital scan breast fine needle aspirate fna slide system us computer vision technique analyse cell nucleus order extract determinate feature try find mean genetic algorithm ga ideal ffsm able classify application breast cancer diagnosis us characteristic inidual cell discriminate benign malignant breast lump system try find texture measurement included feature set order improve classifier performance complexity measurement structural pattern used discriminate benign malign cell measure technique described observed absolute complexity image relevant also way complexity distributed different scale ,4
IMG_215,textile computing share synergistic relationship harnessed create paradigm personalized mobile information processing pmip provide overview interconnection two field vision etextiles represents convergence two field discus role georgia tech wearable motherboard pioneering paradigm fabric computer serving framework pmip finally recent research area resulting realization computational fabric network discussed ,4
IMG_216,hardwaresoftware codesign presented safetycritical embedded computer system system applied endoscope control navigation embedded system architecture provides high performance computing realtime implementation machine vision algorithm faulttolerance patient safety consists five processor core local memory io interface multiport shared memory hardware software system architecture codesigned virtual hardware developed execute application system software task system designed modeled vhdl eaglei toolset limited system verification coverification system hardware architecture faulttolerance strategy coverification result indicate system performance degrades gracefully various fault scenario ,4
IMG_217,augmented reality ar variation virtual reality allows see computer generated virtual object superimposed upon real world kind seethrough headmounted display human user system interact virtual world additional information character description physical object instruction performing physical task form annotation speech instruction image model describes building wireless augmented reality prototype support videobased graphic keyboard interface wearable computer interact virtual object technique identifying real world object estimating coordinate system introduced method utilizes binary square marker identify great number real world object marker tagged computer vision technique ,4
IMG_218,algorithm wavelet transform decomposition cluster workstation described analyzed parallel algorithm employed computation transform structured exchange intermediate transform coefficient restricted neighboring processor amount data communicated independent problem size result show performance parallel implementation improves increasing data size making parallel algorithm particularly suitable application image processing image coding computer vision timing measured myrinet connected beowulf cluster agree well theoretical analysis indicate implementation cost optimal ,4
IMG_219,one method synthesize arbitrary view given environment image based rendering ibr technique view synthesis scanlinebased intermediate view synthesis algorithm presented image rectification applied prewarping processing postwarping matrix specified movement epipoles image warping morphing technique used computer vision simulation result provided synthesis intermediate view method ,4
IMG_220,describes development fixed vision system recover local surface structure highly specular object system utilizes commercial trinocular stereo vision system lowpower twodimensional illuminant local surface structure object obtained projecting coded light pattern onto object many object neither fully specular fully diffuse statistical method mixture model used ide object specular diffuse component order recover local surface structure specular diffuse region system originally designed assist situ repair maintenance manmade orbital object one key challenge facing computer vision system used space presence specular surface virtually manmade orbital object designed used outer space system designed operate without traditional highpowered illuminant laser beam whose radiation interfere sensitive space instrument system designed operate outer space offer many practical nonspace application ,4
IMG_221,visionbased hand gesture recognition provides nature powerful mean humancomputer interaction approach hand image segmentation hand posture recognition hand gesture reconstruction segment hand image complex background color segmentation approach based rce neural network recognize hand posture analyzing topological feature segmented hand also propose reconstruction technique recover hand gesture method estimate fundamental matrix two uncalibrated camera stereo hand image gesturebased humanrobot interface developed demonstrate application hand gesture ,4
IMG_222,describe technique automatically acquiring observation deforming object estimating model deformation observation robotic system developed measuring deformation previously reported pai et al describes technique estimation deformable model based discrete green function measurement acquired stereo vision robot arm position force sensor kind robotic measurement present challenge measurement estimation address technique robotic acquisition deformable object model potential application robotics haptic interface simulation computer graphic virtual reality ,4
IMG_223,concerning robustness mobile robot navigation global selflocalization key feature many application describe efficient bayesian approach hybrid topologicalmetric navigation designed exploit information multiple source sensor data experiment combination odometrylaserscanscomputer vision show system able generate initial position hypothesis cope environmental ambiguity recover severe position error ,4
IMG_224,concept visionpad approach device supporting interaction man machine presented based image pickup system detects hand pointing device position panel information processed system feedback hand position computer machine standard display device concept direct view panel change view direction distance adaptation eye needed obtain reliable input feature allow safe comfortable input especially critical environment eg car well help disabled people demonstrator based plastic optical fibre realized show applicability basic concept various environment even changing illumination condition moreover possibility realization little computational power minimum hardware expense pointed ,4
IMG_225,describe method observing multiple target widearea spatial environment distributed vision system dvs dvs constructed watching station consist camera image processor computer network connects system system goal track multiple people widearea watched single visual sensor approach based three algorithm algorithm realtime human tracking decision algorithm inidual watching station objectmatching method used station also describe experimental result show validity approach ,4
IMG_226,jose visually guided autonomous robotic waiter circulates around room populated group people politely serving appetizer human serving combine element robotics human computer interaction challenging control architecture multiple integration describes purely visionbased approach method mapping localization navigation presented discussed including issue safety robot human humanrobot interaction covered well solution various task specific serving food result method sample experiment laboratory discus experience aaai mobile robot hors doeuvres anyone ? competition jose took first prize ,4
IMG_227,distributed camera system offtheshelf component presented demonstrates capability perform highspeed vision feedback suitable application direct visual servoing limitation hz video sample rate overcome multiple r camera synchronized network capture different instant time camera node computer process video field rate determine pose planar robot joint eigenspace method position information fed back network master computer perform direct visual servoing resulting vision feedback multiple camera us kalman filter estimate position model vision computation transport delay computer simulation result provided number camera varied finally realtime experimental result presented verify approach network four camera performing direct visual servoing simple planar robot ,4
IMG_228,highly curved part object boundary curvature feature regularly correspond characteristic image region high information content make good candidate object recognition establishing image correspondence stereo motion analysis unfortunately computer vision procedure detecting feature must deal conceptual problem context dependency since similar region different context may correspond sometimes salient curvature feature time noise deformed part straight boundary order disambiguate situation robust procedure consider appropriate neighbourhood candidate image location proposed approach dimensionality search reduced preprocessing input image tuned edge detection linking algorithm thus curvature feature searched point ruled preprocessing complexity analysis reduced quadratic linear representative subset processing result provided ,4
IMG_229,assembling mem device manipulating biological cell often beneficial information force applied object force information difficult measure scale demonstrate method reliably measure nanonewton scale force applied micro scale cantilever beam computer vision approach template matching algorithm used estimate beam deflection subpixel resolution order determine force applied beam template addition containing information geometry beam contains information elastic property beam minimizing error elastic template actual image mean numerical optimization technique able measure force spl plusmn nn addition also discus method generalized measure force elastic configuration simple cantilever beam microtweezer example provides opportunity method used specially designed micromanipulators provide force well vision feedback micromanipulation task ,4
IMG_230,u department commerce authorized internet corporation assigned name number icann make nonprofit organization establishes policy govern domain name system decides top level domain add name system add charge settle dispute name assignment oversees dozen company called domainname registrar sell control domain name icann floundering organization based marina del rey calif never manager country code toplevel domain rest world uk united kingdom de germany relation root server operator also strained latter maintain computer around world copy key record toplevel domain name stored corresponding internet protocol address disturbingly icann recently abandoned pledge create membership structure elect powerful member board director currently outside view effect excluded agency icann called supporting organization select board member root icanns trouble paralyzing clash vision organization regarding technical priesthood icann failed international policymaking institution ,4
IMG_231,overview recent methodology modeling human based computer vision method analyze human motion extract invariant motion parameterized way capture nature motion basic parameterized motion altered based additional input form parameter create wide variety human motion paradigm modeling animating human motion deviation traditional approach animation based either exclusively animator skill produce convincing human animation motion capture data sophisticated analysis approach clearly demonstrates synergy computer vision computer graphic method crucial modeling human motion external internal demonstrate several example approach including human walking modeling human anatomy physiology ,4
IMG_232,motion capture effective method creating realistic human motion animation unfortunately quality demand animation place challenging demand capture system date capture solution meet demand required specialized hardware invasive expensive computer vision could make animation data much easier obtain unfortunately current technique fall short demand animation application explore demand animation lead particularly difficult challenge capture technique constraintbased methodology reconstructing motion given image observation tool understanding problem synthetic experiment confirm situation would arise practice experiment show even simple visual tracking information used create human motion even perfect tracking incorrect reconstruction possible inevitable ,4
IMG_233,whole ceramicglass manufacturing process basically operated automatically final stage process concerned visual inspection ie product quality inspection closely related computer vision image processing pattern recognition propose method detect surface defect ceramicglass based digitized image threshold used gain binary image markov random field model fitted binary texture finally experiment carried factory sample used verify feasibility method ,4
IMG_234,imaging channel nonlinear characteristic one factor computer vision error common method distortion correction rely lot prior knowledge interactive information imaging model related structure vision system parameter model identified automatically prevalent significance correct computer vision error imaging model give example micro robot soccer vision system imaging model identifying parameter gaining good result ,4
IMG_235,computing distance map distance transform operation convert image consisting black white pixel image pixel value pair coordinate represents distance location nearest black pixel basic operation image processing computer vision field used expanding shrinking thinning segmentation clustering computing shape object reconstruction etc examines possibility implementing problem finding distance map image efficiently optical bus computational model considered linear array reconfigurable pipelined bus system larpbs introduced recently based current electronic optical technology shown problem n spl time n image implemented olog n log log n bus cycle deterministically olog n bus cycle high probability larpbs nsup processor also show problem solved olog log n bus cycle deterministically ol bus cycle high probability larpbs nsup processor scalability algorithm also discussed briefly algorithm compare favorably best known parallel algorithm problem literature ,4
IMG_236,proposes scheme terrain aided navigation based principle computer vision different conventional terrain matching technique scheme us ccd camera rather barometer radio altimeter sensing element terrain elevation information area rather course vehicle flight drawn ccd image according principle computer vision shorter flight time needed gather sufficient information successful terrain matching hence scheme provides estimation compensation error inertial navigation system rapidly ,4
IMG_237,multimedia understanding fast emerging interdisciplinary research area tremendous potential effective multimedia content intelligent analysis diverse application area increasingly relying multimedia understanding system advance multimedia understanding related directly advance signal processing computer vision pattern recognition multimedia database smart sensor stateoftheart technique multimedia retrieval particular discus multimedia retrieval viewed pattern recognition problem discus reliance powerful pattern recognition machine learning technique increasing field multimedia retrieval stateoftheart multimedia understanding system particular emphasis system semantic video indexing centered around multijects multinets discus semantic retrieval centered around concept context various mechanism modeling concept context ,4
IMG_238,skin color offer strong cue efficient localization tracking human body part video sequence visionbased humancomputer interaction colorbased target localization could achieved analyzing segmented skin color region however one challenge colorbased target tracking color distribution would change different lighting condition fixed color model would inadequate capture nonstationary color distribution time meanwhile fixed skin color model trained data specific person would probably well people although done adaptive color model problem still need study investigation colorbased image segmentation nonstationary colorbased target tracking studying two different representation color distribution propose structure adaptive selforganizing map sasom neural network serf color model experiment show representation powerful efficient image segmentation formulate nonstationary color tracking problem model transduction problem solution offer way adapt transduce color classifier nonstationary color distribution fulfill model transduction propose two algorithm sasom transduction discriminant expectationmaximization em based sasom color model gaussian mixture color model respectively extensive experiment realtime facehand localization show two algorithm successfully handle difficulty nonstationary color tracking also implemented realtime facehand localization system based algorithm visionbased humancomputer interaction ,4
IMG_239,introduces anew freeform surface representation scheme fast accurate registration matching accurate registration surface common computer vision proposed representation scheme capture surface curvature information seen certain point produce image called surface signature point matching signature different surface enables recovery transformation parameter surface propose template matching compare signature image enable partial matching another criterion overlap ratio used representation scheme used global representation surface well local one performs near realtime registration show signature representation used recover scaling transformation well matching object scene presence clutter occlusion application presented include freeform object matching multimodal medical volume registration dental teeth reconstruction intraoral image ,4
IMG_240,order automatically extract arbitrary region image data volume data developed physicsbased approach deformable grid model called active grid active grid extension deformable surface model balloon active net unlike deformable surface model proposed method enables stable extraction region boundary interior information moreover since generated geometry data input directly fem finite element method active grid many potential application including virtual simulation surgery shape modeling computer vision ,4
IMG_241,article describes information network catv application backbone network structure cable natural network carrying highcapacity bandwidthintense information age analogue program signal cable capacity natural transmission mediafor broadcast color tv highfidelity stereo sound program digital program signal age cable high capacity natural network carrying interactive computerbased dataintensive multimedia program introduction computer network ocn providing internet like service lead higherlevel demand user example user asking higher quality greater functionality lower charge highspeed highthroughput data transfer respond effectively wish sophisticated varied user technology development must pursued user point view reason research development performed middleware network function make possible network cooperate article discus development major technology achieving enhanced ocn nextstage ocn become catalyst future multimedia network present future vision network ,4
IMG_242,motion seaice antarctica studied quikscat scatterometer imagery method computer vision image processing intensity edge optical flow feature computed differential invariant based spatial temporal derivative various scale first estimate motion vector field obtained optical flow used starting point regularization scheme imposes constraint bring estimate closer feature tracking result observed motion constraint fluid dynamic brought separating motion field ergence free rotational free component another field obtained convex combination component advantage approach produce dense motion field globally processed locally adjusted fit data model complement analysis sea ice motion application wavelet theory ,4
IMG_243,color provides wealth information interpretation image content increased availability affordable digital color camera created opportunity explore degree color useful computer vision show system image segmentation classification created color primary feature system comprised two phase segmentation classification first step image searched blob detection algorithm determine location possible foreground element area extracted image used next step classification done set eight color feature optimally selected database appropriate feature vector created foreground area removed original image vector compared preconstructed database identified usa postage stamp envelope used test case ,4
IMG_244,disparity estimation basis generation virtual view small set real reference image much research area conducted computer vision community last decade currently problem involved technology well understood exist several wellestablished algorithm render virtual view perspectively different image scene however oriented towards highaccuracy disparity estimation produce highquality virtual image often sophisticated purposebuilt hardware accelerator achieve realtime result two disparity estimator different complexity degree described used examine much disparity inaccuracy influence image rendering quality objective design softwarebased image synthesis realtime conventional pc platform basically look opposite end costcomplexity curve making restrained demand disparity estimator shown empirically many case effect disparity accuracy quality virtual view almost imperceptible many application requiring realtime processing reasonably good result achieved le computational cost ,4
IMG_245,segmentation algorithm extracting arterial structure coronary angiogram presented algorithm mimic process interactive interpretation human vision iteratively implementing ternary classification learning process two grayscale threshold computed define three pixel class artery background undecided two threshold undecided pixel computed statistic conditioned current classification threshold adaptation governed learning algorithm based line consistency measurement around pixel process converges result binary image performance algorithm human coronary arteriogram compared qualitatively relaxation algorithm scatteringbased algorithm quantitative comparison also made possible computer generated image obtained help model imaging chain process interactive visualization modeled data iterative ternary classifier showed best performance broad range image quality also demonstrated visualization interaction model building algorithm development & lt & ltetx & gt & gt ,4
IMG_246,partial differential equation pdes led entire field image processing computer vision typical pde technique image smoothing edge extraction regard original image initial state parabolic diffusionlike process extract filtered version temporal evolution diffusion coefficient varies spatially way intraregion smoothing preferred interregion smoothing thus preventing edge blurring edge dislocation useful application particular diffusion process noise reduction edge detection also propose pixel based clustering scheme color image segmentation incorporates peronamalik diffusion filtering preliminary experimental result show significant improvement segmentation result ,4
IMG_247,present overview level set dynamic contour compare usefulness parametric dynamic contour realtime constrained computer vision parametric model produce worse segmentation handle topological change markedly efficient allowing realtime implementation ,4
IMG_248,choice feature invariant object recognition one essential problem computer vision author previously proposed gabor filtering based feature extraction method successfully applied invariant object recognition gabor filtering based feature extraction analysed term distortion tolerance essential property many application experiment indicate accurate recognition achieved presence significant amount distortion ,4
IMG_249,research discussed component larger explore accessibility usability spatial data presented multiple sensory modality including haptic auditory visual interface geographical information system gi computerbased tool spatial display predominantly vision communicate information sight spatial sense par excellence ongoing research exploring fundamental concept technique necessary navigate multimodal interface domain interface specific highlight necessity conceptualtheoretical schema need extensive usability study preliminary result presented exploring feature recognition shape tracing nonvisual environment indicate multimodal interface great deal potential facilitating access spatial data blind visually impaired person research undertaken wider goal increasing information accessibility promoting universal access ,4
